Requirement_1,Requirement_2,Conflict_Type,Conflict_Reason,Resolution_Suggestion,Expected_Conflict
The bike must have a theft alert system.,The vehicle must use basic security.,Performance Conflict,"A basic security system with a theft alert feature could impact battery life and processing power, potentially hindering the bike's overall performance.","Optimize the theft alert system for low power consumption and minimal processing overhead, balancing security with performance.",Security Conflict
The vehicle must feature a coded lock.,The bike must use a standard key.,Compatibility Conflict,"The coded lock and standard key requirements are incompatible locking mechanisms, making them impossible to implement simultaneously.","Choose either a coded lock or a standard key mechanism, prioritizing security needs and user convenience based on target market.",Security Conflict
The bike must include a tracking chip.,The vehicle must be simple.,Other,"A tracking chip adds complexity to the user experience, potentially making the bike less simple to use, contradicting the simplicity requirement.","Define ""simple"" more precisely (e.g., limited features, intuitive interface) and evaluate tracking chip implementations based on this definition; consider a user-removable chip or a very discreet, low-profile implementation to minimize usability impact.",Security Conflict
The vehicle must have an intuitive voice control.,The bike must use manual controls only.,Contradiction,Voice control and manual controls are mutually exclusive operation methods.,"Clarify which control methods are applicable to which vehicle type (e.g., car vs. bike), or define specific scenarios where each control method is used.",Usability Conflict
The bike must feature a digital interface.,The vehicle must be mechanically simple.,Other,"A digital interface inherently involves complex electronics, conflicting with the desire for mechanical simplicity.","Prioritize a basic digital display showing essential information only, minimizing electronic complexity and using robust, easily maintainable mechanical components for core functions.",Usability Conflict
The vehicle must offer a heads-up display.,The bike must avoid screens.,Contradiction,"A heads-up display inherently uses a screen (or projection technology acting as a screen) to display information, directly conflicting with the requirement to avoid screens.","Re-evaluate the ""avoid screens"" requirement, clarifying acceptable display technologies or contexts, or replace the heads-up display with an alternative information delivery system, like haptic feedback or simplified dashboard gauges.",Usability Conflict
The bike must have automated gear shifting.,The vehicle must use a manual system.,Contradiction,"Automated gear shifting and a manual system are mutually exclusive; one is automatic, the other requires human input.","Clarify which vehicle (bike is mentioned in req 1, general vehicle in req 2) each requirement applies to, or prioritize one system over the other.",Usability Conflict
The vehicle must include a touch panel.,The bike must prioritize simplicity.,Other,"A touch panel may complicate the user interface, conflicting with the desired simplicity of a bicycle.",Explore minimalist touch panel designs or alternative input methods that align with a simple user experience.,Usability Conflict
The bike must offer a smart dashboard.,The vehicle must use analog gauges.,Technology Conflict,"Smart dashboards rely on digital displays and processing, conflicting with the analog nature of analog gauges.",Choose one display type (smart dashboard with digital gauges or traditional dashboard with analog gauges) or explore a hybrid system with limited smart features shown on a small digital screen alongside analog gauges.,Usability Conflict
The vehicle must have a user-friendly app.,The bike must avoid connectivity.,Usability Conflict,"A user-friendly app typically requires connectivity to function effectively, directly contradicting the requirement to avoid connectivity.","Redefine ""user-friendly app"" to encompass offline functionality or explore alternative user interfaces that minimize or eliminate connectivity needs.",Usability Conflict
The bike must include a navigation screen.,The vehicle must be basic.,Other,"A navigation screen implies advanced technology that contradicts the ""basic"" vehicle requirement.","Redefine ""basic"" to allow for essential technology or replace the advanced screen with a basic, visual navigation aid.
Conflict_Type: Cost Conflict",Usability Conflict
The vehicle must feature auto-adjust seats.,The bike must use fixed seating.,Contradiction,"Auto-adjust seats and fixed seating are mutually exclusive, directly opposing requirements for a vehicle that is both a ""vehicle"" and a ""bike"" simultaneously.","Clarify whether the ""vehicle"" and ""bike"" refer to the same product or two different products, and if the same, prioritize one seating type based on the vehicle's primary use case and target market, or design a compromise that offers limited adjustability while retaining a fixed base.",Usability Conflict
The bike must have a customizable UI.,The vehicle must stay simple.,Other,"Resolution: Implement a modular customization approach with pre-set simple profiles, allowing users to optionally delve into advanced customization.",Requires manual review,Usability Conflict
"The vehicle must need service every 25,000 km.",The bike must use a high-maintenance engine.,Reliability Conflict,"High-maintenance engines typically require more frequent servicing than engines designed for longer service intervals, directly conflicting with the 25,000 km service interval requirement.","Select a high-maintenance engine that, through design optimization and component selection, can reliably operate for 25,000 km between services, or adjust the service interval to align with the engine's maintenance needs.",Maintenance Conflict
The bike must have a self-repairing tire system.,The vehicle must require frequent checks.,Reliability Conflict,"A self-repairing tire system is designed to minimize the need for checks, directly contradicting the requirement for frequent checks.","Re-evaluate the tire system; if truly self-repairing, reduce check frequency; if ""self-repairing"" only handles minor issues, clarify check frequency guidelines.",Maintenance Conflict
The vehicle must last 5 years without service.,The bike must use a complex motor.,Reliability Conflict,"Complex motors inherently have more potential failure points, making a 5-year no-service period challenging.","Simplify the motor design, use higher quality components, or implement predictive maintenance systems to mitigate potential failures.",Maintenance Conflict
The bike must need minimal upkeep.,The vehicle must include intricate parts.,Maintenance Conflict,"Intricate parts generally require more frequent and specialized maintenance, directly contradicting the requirement for minimal upkeep.","Simplify intricate parts where possible, use durable materials for those that remain, and design for easy access for maintenance.",Maintenance Conflict
The vehicle must have a low-maintenance design.,The bike must use a hybrid system.,Other,"Hybrid systems introduce additional components (electric motor, battery, power electronics) requiring specialized maintenance, contrasting with the goal of low maintenance.","Prioritize modular design for the hybrid components, select highly reliable components, and develop a comprehensive preventative maintenance schedule targeting the hybrid system to minimize unexpected repairs and ensure accessibility.",Maintenance Conflict
"The bike must require service every 30,000 km.",The vehicle must have a delicate engine.,Other,"Delicate engines usually require more frequent maintenance to ensure optimal performance and longevity, conflicting with a long service interval.","Redesign the engine to be more robust while maintaining desired performance characteristics, or revise the service interval to align with the engine's maintenance needs, potentially adding more frequent but less intensive checks.",Maintenance Conflict
The vehicle must avoid regular maintenance.,The bike must use high-wear components.,Reliability Conflict,"High-wear components inherently reduce vehicle reliability and increase maintenance frequency, directly contradicting the requirement for minimal maintenance.",Prioritize components with extended lifecycles and self-diagnostic capabilities to minimize maintenance needs while ensuring acceptable performance levels.,Maintenance Conflict
The bike must have a durable finish.,The vehicle must need constant care.,Reliability Conflict,"A durable finish implies minimal maintenance and high reliability, conflicting with the requirement for constant care, which suggests unreliability and frequent maintenance.","Define the scope of ""durable finish"" and ""constant care"" more precisely with specific metrics (e.g., corrosion resistance, maintenance frequency) and revise the requirements to be less contradictory, perhaps specifying specific maintenance tasks needed.",Maintenance Conflict
The vehicle must use long-life parts.,The bike must require frequent repairs.,Contradiction,"Long-life parts inherently reduce the need for frequent repairs, directly contradicting the second requirement.","Re-evaluate the requirements, clarifying the intended lifespan and repair frequency; one requirement needs to be changed to align with realistic engineering goals.",Maintenance Conflict
The bike must minimize service needs.,The vehicle must use fragile tech.,Reliability Conflict,Fragile technology inherently increases the likelihood of breakdowns and service needs.,"Employ robust testing, redundancy, or less fragile technology where possible to balance performance with reliability, or schedule frequent maintenance.",Maintenance Conflict
The vehicle must weigh under 110 kg.,The bike must include a heavy battery.,Other,"A heavy battery will contribute significantly to the overall weight of the vehicle, potentially exceeding the 110 kg limit.","Optimize battery chemistry for higher energy density with less weight, explore lightweight vehicle materials, or increase the allowed weight limit after re-evaluating performance needs and regulations.",Weight Conflict
The bike must stay under 120 kg.,The vehicle must use a steel frame.,Other,"A steel frame is heavier than alternative materials like aluminum or carbon fiber, potentially making it difficult to meet the 120 kg weight limit.","Explore high-strength, low-alloy steel options with optimized frame geometry, or consider a hybrid frame using steel in critical areas and lighter materials elsewhere to balance strength and weight.",Weight Conflict
The vehicle must be ultra-light at 100 kg.,The bike must have a large fuel tank.,Weight Conflict,"A large fuel tank inherently adds significant weight, conflicting with the ultra-light requirement.","Explore alternative fuel sources with higher energy density but lower weight, or significantly reduce fuel tank size and range.",Weight Conflict
The bike must weigh under 130 kg.,The vehicle must include a robust chassis.,Other,"A robust chassis, designed for high strength and durability, typically necessitates heavier materials and a more complex structural design, directly increasing the overall weight of the bike, potentially exceeding the 130 kg limit.","Explore high-strength, lightweight materials like advanced composites (carbon fiber, titanium alloys) for chassis construction; Optimize chassis design using finite element analysis (FEA) to reduce material usage without compromising structural integrity.",Weight Conflict
The vehicle must minimize weight to 140 kg.,The bike must use a heavy motor.,Weight Conflict,"A heavy motor directly contradicts the requirement to minimize the vehicle's weight to 140 kg, as the motor's mass will significantly contribute to the overall weight.","Optimize motor design using lightweight materials, explore alternative motor technologies with higher power-to-weight ratios, or reassess the 140 kg weight target considering the motor's weight and performance requirements.",Weight Conflict
The bike must be under 150 kg.,The vehicle must have a reinforced body.,Weight Conflict,"A reinforced body generally adds significant weight, potentially exceeding the 150 kg limit.","Use lightweight, high-strength materials like carbon fiber or aluminum alloys in the reinforced body, optimizing the design to minimize weight while maintaining structural integrity.",Weight Conflict
The vehicle must weigh under 115 kg.,The bike must include extra storage.,Other,"Adding extra storage inherently adds weight, potentially exceeding the 115 kg limit.",Utilize lightweight materials for the storage components and optimize the overall design to minimize weight.,Weight Conflict
The bike must stay light at 125 kg.,The vehicle must use a solid frame.,Other,"A solid frame, while providing structural integrity, typically adds significant weight.","Use advanced lightweight materials like carbon fiber or aluminum alloys for the frame, optimizing the frame design to minimize material usage while maintaining required strength, and explore weight reduction in other components.
```",Weight Conflict
The vehicle must be under 135 kg.,The bike must have a big battery.,Other,"A large battery typically adds significant weight, making it challenging to keep the vehicle under 135 kg.","Utilize advanced lightweight battery technology (e.g., solid-state batteries, optimized battery cell packaging), lightweight vehicle frame materials (e.g., carbon fiber, aluminum alloys), and optimize overall vehicle design to minimize weight while maintaining the desired battery capacity.",Weight Conflict
The bike must weigh under 145 kg.,The vehicle must include a heavy suspension.,Other,"A heavy suspension system will inherently increase the vehicle's weight, potentially exceeding the 145 kg limit.","Optimize the suspension design using lightweight materials like aluminum alloys or composite materials, and explore alternative suspension geometries to minimize weight while maintaining performance.
```",Weight Conflict
The vehicle must launch in 4 months.,The bike must pass rigorous testing.,Time-to-Market Conflict,"Rigorous testing takes time, potentially conflicting with a tight launch deadline.","Parallelize testing phases, prioritize critical tests, and allocate sufficient resources to reduce testing duration without compromising safety.",Time-to-Market Conflict
The bike must be ready in 6 months.,The vehicle must meet new safety laws.,Other,"Meeting new safety laws may involve design changes, prototyping, and rigorous testing which can be time-consuming.","Prioritize safety-critical features early in the design process, conduct parallel testing where possible, and potentially negotiate a longer timeframe if necessary for comprehensive safety validation.
Time-to-Market Conflict: Designing, testing, and manufacturing a bike to meet new safety laws within 6 months might be challenging and increase development risk.",Time-to-Market Conflict
The vehicle must hit the market in 8 months.,The bike must undergo long trials.,Time-to-Market Conflict,"Long trials require significant time, potentially exceeding the 8-month market launch timeframe.","Reduce trial duration by employing accelerated testing methodologies, prioritizing critical tests, and leveraging simulation tools.",Time-to-Market Conflict
The bike must launch in 5 months.,The vehicle must certify emissions.,Time-to-Market Conflict,"Emissions certification can take longer than 5 months, potentially delaying the launch.","Expedite the certification process, perform parallel development, or delay launch if certification is unachievable in time.",Time-to-Market Conflict
The vehicle must be out in 7 months.,The bike must complete durability tests.,Other,Resolution: Conduct accelerated durability testing or parallelize design and testing phases to meet both requirements.,Requires manual review,Time-to-Market Conflict
The bike must launch in 9 months.,The vehicle must pass crash tests.,Time-to-Market Conflict,"Achieving stringent crash test performance within a 9-month timeframe is often challenging due to the iterative design, prototyping, and testing cycles required for safety validation.",Prioritize safety testing early in the development process and consider leveraging existing crash test data or simulation models to accelerate validation.,Time-to-Market Conflict
The vehicle must be ready in 3 months.,The bike must meet strict standards.,Other,"Meeting strict standards in a short timeframe usually entails higher development and manufacturing costs (e.g. more testing, more expensive materials) which might conflict with existing budget.","Re-evaluate the standards to determine if some aspects can be relaxed without compromising safety or customer satisfaction, or request additional budget.

Time-to-Market Conflict: Time-to-Market",Time-to-Market Conflict
The bike must hit stores in 10 months.,The vehicle must finish R&D.,Time-to-Market Conflict,"R&D completion time is inherently uncertain and may exceed the 10-month market launch window, potentially delaying the product release.","Implement parallel development strategies, prioritize critical R&D tasks, and establish contingency plans for potential R&D delays to ensure the bike can launch on schedule.",Time-to-Market Conflict
The vehicle must launch in 12 months.,The bike must pass global regs.,Time-to-Market Conflict,"Passing global regulations (especially safety and emissions) can be a lengthy and unpredictable process, potentially exceeding the 12-month launch timeframe.","Parallelize regulatory testing with development, prioritize markets with less stringent regulations for initial launch, or adjust the launch timeline.",Time-to-Market Conflict
The bike must be out in 11 months.,The vehicle must test extensively.,Time-to-Market Conflict,"Extensive testing inherently takes time, potentially exceeding the 11-month deadline.","Streamline the testing process, prioritize critical tests, or accept a slightly delayed launch to ensure adequate testing.",Time-to-Market Conflict
The vehicle must use USB-C charging.,The bike must support legacy ports.,Compatibility Conflict,"USB-C and legacy ports may have different voltage/amperage requirements, potentially damaging devices connected to the legacy ports if the system attempts to provide USB-C level power.","Isolate legacy ports with current limiting circuits and clear labeling, ensuring they only provide power within legacy specifications to avoid damaging devices not compatible with USB-C's power delivery capabilities.",Compatibility Conflict
The bike must integrate with Android Auto.,The vehicle must use iOS only.,Other,"Android Auto and iOS are mutually exclusive operating systems, making simultaneous integration impossible.","Choose one operating system (Android Auto or iOS) for integration or explore solutions that provide compatibility with both, though that significantly increases complexity and cost.",Compatibility Conflict
The vehicle must support universal tires.,The bike must use custom wheels.,Compatibility Conflict,"Universal tires are designed for specific rim sizes, which may not be compatible with custom wheels that often deviate from standard dimensions.","Specify the acceptable range of custom wheel dimensions that can accommodate a range of universal tires, or redefine ""universal tires"" to mean a more limited, compatible subset.",Compatibility Conflict
The bike must use a standard battery.,The vehicle must have a unique pack.,Other,"A ""standard battery"" implies common dimensions, voltage, and interfaces, while a ""unique battery pack"" suggests a custom design deviating from these standards.","Clarify the scope of ""unique""; perhaps it refers only to the battery management system (BMS) or pack configuration while still adhering to standard cell formats.",Compatibility Conflict
The vehicle must work with old accessories.,The bike must use new tech.,Other,"New technologies may be incompatible or require modifications to interface with older accessories, potentially negating their functionality without adaptors.",Design an interface with backwards compatibility or provide adaptors for older accessories.,Compatibility Conflict
The bike must support Bluetooth 5.0.,The vehicle must use Bluetooth 4.0.,Technology Conflict,Bluetooth 5.0 and 4.0 are incompatible technologies; using both simultaneously is technically infeasible as the vehicle needs to choose only one radio version to operate.,"Clarify which Bluetooth version is required for the specific application to choose one version only, or specify which system should use which bluetooth version, if they are separate.",Compatibility Conflict
The vehicle must use a common charger.,The bike must have a proprietary plug.,Compatibility Conflict,"A common charger necessitates a standard plug, conflicting with the requirement for a proprietary plug.",Redesign to either use a standard connector or ensure a readily available adapter for common chargers.,Compatibility Conflict
The bike must fit standard racks.,The vehicle must use custom mounts.,Other,"Resolution: Negotiate a solution that allows for standard rack compatibility (e.g., using adapters) while incorporating custom mounts for specific features or accessories.",Requires manual review,Compatibility Conflict
The vehicle must support open-source software.,The bike must use closed systems.,Technology Conflict,"Open-source software mandates accessible and modifiable systems, conflicting directly with the closed systems requirement that restricts access and modification.","Re-evaluate which vehicle systems require closed vs. open architecture based on security, safety, and development resources, potentially isolating critical functions to closed systems and non-critical systems to open-source.",Compatibility Conflict
The bike must use universal connectors.,The vehicle must have unique ports.,Compatibility Conflict,"Universal connectors ensure broad compatibility, while unique ports intentionally limit compatibility, creating a direct contradiction.",Standardize on a widely adopted connector standard (like USB-C) while still allowing for customization via adapters if unique port functionality is truly necessary.,Compatibility Conflict
The vehicle must have a sleek modern look.,The bike must use a boxy frame.,Aesthetic Conflict,"A sleek modern look typically contrasts with a boxy frame, creating a visually unappealing design.","Redesign the frame to incorporate more modern design elements while maintaining structural integrity, or adjust the definition of ""sleek modern look"" to allow for boxier forms.",Aesthetic Conflict
The bike must feature a vintage style.,The vehicle must be aerodynamic.,Other,"Vintage styling often involves less streamlined shapes and exposed features that hinder aerodynamic performance, clashing with modern aerodynamic principles focused on smooth surfaces and minimal drag.","Compromise by incorporating subtle vintage cues into an overall aerodynamic design (e.g., retro-inspired paint schemes on a streamlined frame), prioritizing aerodynamic performance while maintaining a vintage feel in specific design elements.

Conflict_Type: Performance Conflict",Aesthetic Conflict
The vehicle must use sharp angular lines.,The bike must have a rounded design.,Aesthetic Conflict,"Sharp angular lines and a rounded design are visually contradictory, leading to an aesthetically unappealing vehicle.","Re-evaluate design language; either prioritize angularity or roundness, or find a way to blend both styles harmoniously by applying angular features to rounded base body using vehicle styling principles.",Aesthetic Conflict
The bike must have a minimalist look.,The vehicle must include ornate details.,Aesthetic Conflict,"Minimalism emphasizes simplicity and lack of ornamentation, directly opposing the inclusion of ornate details, which are inherently complex and decorative.","Re-evaluate target audience and design philosophy; consider a balance, perhaps minimalist overall with strategically placed, smaller ornate details, or segment the product line.",Aesthetic Conflict
The vehicle must feature a retro finish.,The bike must optimize airflow.,Performance Conflict,"Retro finishes, such as chrome or complex curves, can disrupt airflow optimization which prioritizes smooth, aerodynamic surfaces.","Aerodynamically optimize the vehicle form first, then apply retro finish details strategically to minimize drag and maximize visual impact, perhaps using retro-inspired decals instead of fully contoured chrome.",Aesthetic Conflict
The bike must use a bold color scheme.,The vehicle must be subtle.,Aesthetic Conflict,"A bold color scheme directly opposes the subtlety requirement, creating a visually discordant design.","Negotiate a compromise where boldness is achieved through subtle patterns or contrasting trim rather than overall bright colors, or prioritize one requirement based on market analysis.",Aesthetic Conflict
The vehicle must have a futuristic design.,The bike must look classic.,Aesthetic Conflict,"""Futuristic"" and ""classic"" represent opposing aesthetic design philosophies.","Define specific design elements for each aspect, potentially using classic elements with futuristic materials or incorporating classic design language with modern technology to create a neo-classic style, balancing both requirements.",Aesthetic Conflict
The bike must feature chrome accents.,The vehicle must be streamlined.,Other,"Chrome accents may disrupt a streamlined aesthetic, prioritizing style over aerodynamic efficiency.",Explore alternative materials or finishes that achieve a similar visual effect while maintaining aerodynamic performance.,Aesthetic Conflict
