Requirement_1,Requirement_2,Conflict_Type,Conflict_Reason,Resolution_Suggestion,Expected_Conflict
The bike must have zero-emission tech.,The vehicle must prioritize power output.,Performance Conflict,"Zero-emission technologies, particularly electric, may limit instantaneous power output compared to internal combustion engines.","Explore advanced battery technologies, hybrid solutions, or fuel cell technologies to enhance power output while maintaining zero emissions, or adjust the power output target.",Environmental Conflict
The vehicle must use sustainable fuel.,The bike must reach 180 km/h.,Other,"Achieving 180 km/h might require sacrificing some fuel efficiency and sustainability, especially with current sustainable fuel technology.","Invest in advanced engine technology and aerodynamics optimized for sustainable fuels to balance performance and sustainability.
Conflict_Type: Technology Conflict",Environmental Conflict
The bike must minimize environmental impact.,The vehicle must have a 30 HP engine.,Other,"Resolution: Explore alternative fuel options (biofuels, synthetic fuels), implement advanced emission control technologies, or consider a hybrid or electric powertrain to reduce environmental impact while still meeting the performance requirement, balancing power output with reduced emissions through efficient engine design and catalytic converters.",Requires manual review,Environmental Conflict
The vehicle must use a rigid aluminum frame.,The bike must weigh under 120 kg.,Other,"A rigid aluminum frame, while strong, can be heavy, making it challenging to meet the 120 kg weight requirement, especially when considering other vehicle components.","Explore high-strength, lightweight aluminum alloys or composite materials, optimize frame geometry to reduce material usage without compromising rigidity, and carefully select lightweight components for the rest of the vehicle.
```",Structural Conflict
The bike must have a reinforced chassis.,The vehicle must be lightweight.,Weight Conflict,"A reinforced chassis typically requires more material, increasing the vehicle's overall weight, directly contradicting the requirement for a lightweight vehicle.","Use high-strength, lightweight materials like carbon fiber or aluminum alloys for the chassis to balance reinforcement with weight reduction, optimizing structural integrity without excessive mass.",Structural Conflict
The vehicle must include a steel roll bar.,The bike must stay under 110 kg.,Other,"A steel roll bar adds significant weight, potentially pushing the vehicle over the 110 kg limit.","Explore lighter high-strength materials like aluminum alloys or advanced composites for the roll bar, or optimize the rest of the vehicle's design to reduce weight elsewhere.",Structural Conflict
The bike must use a durable composite body.,The vehicle must reduce weight.,Weight Conflict,"Durable composites, while strong, may still add weight compared to other lighter materials like aluminum or advanced polymers, thus hindering weight reduction efforts.",Specify the exact composite material and target weight range to determine the net weight impact; investigate alternative lightweight composites or optimize the composite layup for strength-to-weight ratio.,Structural Conflict
The vehicle must have a solid frame design.,The bike must weigh under 130 kg.,Other,"A ""solid frame design"" prioritizes structural integrity, often leading to a heavier frame that may be difficult to achieve while simultaneously adhering to a strict weight limit of 130 kg.","Optimize frame design using lightweight materials like high-strength steel alloys or composites, perform FEA analysis to minimize material usage while maintaining structural integrity, and consider alternative frame geometries.
```",Structural Conflict
The bike must include a heavy-duty chassis.,The vehicle must be light.,Weight Conflict,"A heavy-duty chassis inherently adds weight, conflicting with the requirement to be light.",Optimize chassis design using lightweight materials and advanced structural analysis to achieve required strength with minimal weight.,Structural Conflict
The vehicle must use a thick steel structure.,The bike must minimize weight.,Weight Conflict,"A thick steel structure inherently adds significant weight, contradicting the weight minimization requirement.","Explore alternative high-strength, lightweight materials like high-strength steel alloys or aluminum alloys, optimizing structural design to reduce material usage while maintaining strength, or compromise on the thickness of the steel.",Structural Conflict
The bike must have a robust frame.,The vehicle must weigh under 140 kg.,Other,"A robust frame, designed for durability and safety, often necessitates heavier materials or more complex structural designs, directly increasing the bike's overall weight.","Employ advanced lightweight materials like high-strength steel alloys, aluminum alloys, or carbon fiber composites in the frame construction, optimizing the design to minimize material usage while maintaining structural integrity, and carefully consider the frame geometry to balance weight and strength.
```",Structural Conflict
The vehicle must include a reinforced body.,The bike must be ultra-light.,Weight Conflict,"A reinforced body inherently adds weight, contradicting the ultra-light requirement.","Explore high-strength, low-density materials like carbon fiber or advanced aluminum alloys to provide reinforcement without significantly increasing weight.",Structural Conflict
The bike must use a strong alloy frame.,The vehicle must stay under 150 kg.,Weight Conflict,"A strong alloy frame, while beneficial for strength, can be heavier than frames made of alternative materials like carbon fiber or aluminum alloys, potentially making it difficult to meet the 150kg weight requirement.","Specify the alloy type and frame geometry, conduct FEA to optimize strength with minimal weight, and consider lighter components for other vehicle parts.",Structural Conflict
The vehicle must have adjustable cushioned seats.,The bike must minimize power usage.,Comfort Conflict,"Adjustable cushioned seats typically increase weight and complexity, potentially increasing power consumption, conflicting with the need to minimize power usage.","Select lightweight, energy-efficient materials and design for the adjustable seating mechanism; optimize seat heater power usage, if present.",Comfort Conflict
The bike must include a climate-controlled cabin.,The vehicle must reduce energy draw.,Other,"Climate control systems, especially in a small bike cabin, require significant energy.","Implement a highly efficient climate control system, explore alternative energy sources (solar, regenerative braking), and optimize cabin insulation to minimize energy consumption.""
*   **Cost Conflict: {Yes}",Comfort Conflict
The vehicle must offer a plush interior.,The bike must use a low-power system.,Other,"Plush interiors typically involve heavier materials, potentially increasing overall vehicle weight, which contradicts the low-power system requirement aiming for efficiency.","Explore lightweight, high-quality materials for the plush interior that minimize weight impact, and optimize the low-power system's efficiency to compensate for any remaining weight increase.",Comfort Conflict
The bike must have ergonomic handlebars.,The vehicle must avoid extra power needs.,Cost Conflict,"Ergonomic handlebars can sometimes require more expensive materials and complex designs, potentially increasing manufacturing costs, conflicting with the need to minimize power consumption by diverting resources",Explore cost-effective ergonomic handlebar designs that minimize material usage and manufacturing complexity while still providing sufficient comfort.,Comfort Conflict
The vehicle must include a heated steering wheel.,The bike must conserve battery.,Battery Conflict,"Heated steering wheels consume significant electrical power, potentially conflicting with the requirement to conserve battery power, especially in electric vehicles.","Implement a low-power heating element for the steering wheel with user-adjustable intensity levels and a timer, coupled with regenerative braking to offset power consumption.",Comfort Conflict
The bike must offer a soft suspension.,The vehicle must limit energy use.,Other,"Softer suspensions typically absorb more energy during compression and rebound, reducing the overall efficiency and potentially requiring more rider effort (or motor power in an e-bike) to maintain a desired speed.","Explore energy-efficient suspension designs, such as those with optimized damping and minimal hysteresis, or consider semi-active or active suspension systems that can adapt to terrain while minimizing energy consumption.**
*   **Weight Conflict: {Weight Conflict}",Comfort Conflict
The vehicle must have luxury upholstery.,The bike must reduce power consumption.,Cost Conflict,"Luxury upholstery typically increases vehicle cost, while reducing power consumption often requires more expensive and efficient components and engineering, leading to increased overall expense.",Investigate cost-effective luxury upholstery alternatives and prioritize power reduction in areas that minimally impact overall vehicle cost.,Comfort Conflict
The bike must include padded grips.,The vehicle must optimize efficiency.,Other,"Padded grips add weight and potentially aerodynamic drag, slightly reducing overall efficiency.","Select lightweight, aerodynamic padded grips and optimize tire pressure to offset the weight gain and maintain desired efficiency levels.",Comfort Conflict
The vehicle must offer a quiet ride.,The bike must minimize electrical load.,Design Conflict,"Achieving a very quiet ride often requires active noise cancellation or extensive sound dampening, which adds electrical load from additional components like speakers, microphones, and processing units.",Optimize noise reduction strategies through passive methods like improved aerodynamics and body insulation before resorting to active noise cancellation.,Comfort Conflict
The bike must have a reclining seat.,The vehicle must save energy.,Other,"Reclining seats typically add more weight than standard bike seats, requiring more energy to propel the bike.","Design a lightweight reclining seat using advanced materials, optimize aerodynamics, and possibly consider electric assist to offset the added weight.*
*   **Performance Conflict:** *Conflict_Type: Performance Conflict",Comfort Conflict
The vehicle must use a diesel engine.,The bike must have a 200 km electric range.,Other,A diesel engine and electric bike with a 200km range are mutually exclusive powertrains for a single vehicle.,"The requirements need to be revised, specifying either a hybrid powertrain, or clearly defining two separate vehicles (one diesel, one electric bike), or reframing to focus on performance metrics that could be met by alternate solutions.",Power Source Conflict
The bike must be fully electric.,The vehicle must use a gasoline motor.,Power Source Conflict,A vehicle cannot simultaneously be fully electric and use a gasoline motor due to fundamentally different power sources.,"Choose either a fully electric powertrain or a gasoline-powered powertrain, or consider a hybrid powertrain solution.
Conflict_Type: Contradiction",Power Source Conflict
The vehicle must run on hybrid power.,The bike must be purely gas-powered.,Contradiction,"Hybrid power necessitates both electric and gas components, contradicting the requirement for purely gas-powered operation.","Clarify the requirements; either the vehicle must be hybrid, or it must be purely gas-powered, but not both simultaneously.",Power Source Conflict
The bike must use a fuel cell system.,The vehicle must rely on a petrol engine.,Power Source Conflict,"A fuel cell and a petrol engine are mutually exclusive power sources for a single vehicle; one uses hydrogen (or other fuel) to generate electricity, while the other burns gasoline for mechanical power.","Choose one power source based on priorities like emissions, range, refueling infrastructure, and cost.",Power Source Conflict
The vehicle must have an electric motor.,The bike must use diesel fuel.,Power Source Conflict,"Electric motors and diesel engines require fundamentally different power sources and drivetrain configurations, making simultaneous implementation impossible.","Choose either an electric motor or a diesel engine; a hybrid system could be considered if the goal is to combine benefits, but this requires significant redesign and resource allocation.
Conflict_Type: Contradiction",Power Source Conflict
The bike must run on battery power.,The vehicle must use a combustion engine.,Power Source Conflict,A vehicle cannot simultaneously run solely on battery power and a combustion engine as they are mutually exclusive power sources.,"Choose either a battery-electric powertrain or a combustion engine powertrain, or explore hybrid options.",Power Source Conflict
The vehicle must be hydrogen-powered.,The bike must use gasoline.,Power Source Conflict,Hydrogen and gasoline are mutually exclusive power sources for the same vehicle.,Clarify if the requirements pertain to different vehicles or prioritize one power source.,Power Source Conflict
The bike must have a plug-in electric system.,The vehicle must use a diesel motor.,Power Source Conflict,"A plug-in electric system requires an electric motor and battery, fundamentally incompatible with a diesel motor, which relies on combustion of diesel fuel.","Choose either a plug-in electric system OR a diesel motor, not both; consider a hybrid powertrain as a compromise if some electrical assistance alongside diesel power is desired.",Power Source Conflict
The vehicle must use a dual-fuel system.,The bike must be electric-only.,Contradiction,"Dual-fuel systems inherently require combustion, conflicting with the electric-only requirement for a bicycle.","Revise either requirement; allow a hybrid bike (electric motor with auxiliary engine for specific dual-fuel functionality, and accept bike if it should be car.)",Power Source Conflict
The bike must rely on solar charging.,The vehicle must use a gas engine.,Power Source Conflict,"Solar charging is an electric power source, while a gas engine is an internal combustion power source, mutually exclusive options for primary propulsion.","Choose either solar-assisted electric drive or a gas engine, or implement a hybrid system with both, prioritizing one as the primary power source.",Power Source Conflict
The vehicle must offer a 7-year warranty.,The bike must use cheap plastic parts.,Reliability Conflict,"Cheap plastic parts are prone to failure, negatively impacting the vehicle's reliability and increasing warranty claims, conflicting with the goal of a 7-year warranty.","Increase the quality of plastic parts to balance cost and reliability, or shorten the warranty period to reflect the expected lifespan of the cheaper parts.",Reliability Conflict
The bike must last 15 years.,The vehicle must use low-durability materials.,Reliability Conflict,"Low-durability materials inherently reduce the overall reliability and lifespan of the bike, conflicting with the 15-year lifespan requirement.","Re-evaluate material selection, prioritizing materials with higher durability and fatigue resistance, even if it increases cost or weight slightly, to meet the lifespan requirement.",Reliability Conflict
The vehicle must have a robust engine.,The bike must use disposable components.,Reliability Conflict,"Robust engines are generally designed for longevity and durability, conflicting with the use of disposable components which inherently prioritize short-term use and easy replacement over long-term reliability.",Redefine 'robust' to specify acceptable lifespan or clarify the specific engine components that can be disposable without compromising overall engine function.,Reliability Conflict
"The bike must ensure 100,000 km lifespan.",The vehicle must cut material costs.,Other,"Resolution: Conduct a value engineering analysis to identify cost-saving opportunities that do not significantly impact the bike's lifespan, such as optimizing design or sourcing alternative materials with comparable performance.",Requires manual review,Reliability Conflict
The vehicle must be highly durable.,"The bike must use lightweight, weak parts.",Design Conflict,"High durability necessitates robust, strong materials, directly contradicting the use of lightweight, weak parts which inherently compromise durability.","Re-evaluate material selection; prioritize durability in key structural components while exploring lightweight options for non-critical areas, potentially using advanced materials with high strength-to-weight ratios.",Reliability Conflict
The bike must have a reliable battery.,The vehicle must use low-cost cells.,Reliability Conflict,"Low-cost battery cells often have lower quality control and shorter lifespans, reducing battery reliability.","Define acceptable reliability metrics and establish a minimum quality standard for ""low-cost"" cells, potentially increasing initial battery cost.",Reliability Conflict
The vehicle must withstand harsh conditions.,The bike must use budget materials.,Other,Budget materials may not provide the required durability to withstand harsh conditions.,"Conduct material testing to identify budget-friendly materials that meet the minimum required durability standards, potentially accepting slightly increased maintenance needs.",Reliability Conflict
The bike must offer long-term reliability.,The vehicle must reduce part quality.,Other,Reducing part quality directly undermines long-term reliability; lower quality parts are inherently more prone to failure.,Invest in robust design and material selection practices that enhance the durability of all component.,Reliability Conflict
The vehicle must have a 5-year guarantee.,The bike must use short-life plastics.,Reliability Conflict,"Short-life plastics are inherently less reliable and durable than longer-life plastics, making it challenging to offer a 5-year guarantee without significant warranty claims and costs.","Investigate the specific plastic components and their failure modes, and either use longer-life alternatives in critical areas or significantly increase predicted lifespan of the short-life plastics through rigorous testing and design margins.",Reliability Conflict
The bike must ensure engine longevity.,The vehicle must use low-grade steel.,Other,"Low-grade steel may compromise engine mounting integrity and cooling efficiency, leading to accelerated wear and tear.","Invest in strategically placed high-strength steel components around the engine mount or explore advanced cooling system designs to compensate for potential material limitations.
Reliability Conflict: Low-grade steel decreases overall vehicle reliability while engine longevity relies on its quality.",Reliability Conflict
The vehicle must support multiple configurations.,The bike must weigh under 110 kg.,Other,"Supporting multiple configurations often necessitates additional components or reinforcement, which can increase weight and potentially exceed the 110 kg limit.","Employ lightweight materials (e.g., carbon fiber, aluminum alloys) in configurable components and optimize design to minimize structural reinforcement where possible.
```",Scalability Conflict
The bike must allow modular upgrades.,The vehicle must be ultra-light.,Other,"Adding modular upgrade interfaces and replaceable components typically increases weight, directly opposing the ultra-light requirement.","Utilize lightweight materials for modular components and interfaces, optimize component size, and potentially limit the number/type of upgrades to control weight.
*   **Cost Conflict:** {type: Cost Conflict}",Scalability Conflict
The vehicle must offer expandable features.,The bike must minimize weight.,Weight Conflict,"Expandable features often require additional components and structures, inevitably adding weight to the vehicle.",Employ lightweight materials and modular design strategies to minimize the weight impact of expandable features.,Scalability Conflict
The bike must support add-on accessories.,The vehicle must stay under 120 kg.,Weight Conflict,"Add-on accessories and their mounting hardware contribute to the overall weight, potentially pushing the bike over the 120kg limit.","Optimize accessory design for lightweight materials and efficient mounting, or reduce weight in other areas of the bike's structure to compensate.",Scalability Conflict
The vehicle must have a scalable platform.,The bike must reduce mass.,Other,"A scalable platform often requires added structural supports and adaptable components, which add weight, conflicting with the requirement to reduce mass.",Optimize material selection and structural design for both scalability and weight reduction using advanced materials and finite element analysis.,Scalability Conflict
The bike must allow future expansions.,The vehicle must be lightweight.,Other,Resolution: Employ lightweight materials and modular design principles that minimize weight increase during expansions.,Requires manual review,Scalability Conflict
The vehicle must support variant designs.,The bike must weigh under 130 kg.,Other,"Supporting variant designs often increases complexity and parts inventory, raising manufacturing costs and potentially making it harder to achieve the weight target within a specific budget.","Implement modular design and platform engineering principles to minimize variant-specific components, balance cost, and achieve the weight target.
Weight Conflict: Weight Conflict",Scalability Conflict
The bike must have a flexible chassis.,The vehicle must limit weight.,Other,"A flexible chassis, while improving ride comfort and handling, often requires additional material or complex structures, leading to increased weight.",Employ lightweight materials and optimized structural designs for the flexible chassis to minimize weight gain.,Scalability Conflict
The vehicle must offer upgrade options.,The bike must stay under 140 kg.,Weight Conflict,"Upgrade options (e.g., larger battery, advanced suspension) often add weight, potentially exceeding the 140 kg limit.","Carefully select lightweight upgrade materials and design components, prioritizing weight optimization during the upgrade design process and setting maximum weight budgets for each potential upgrade.",Scalability Conflict
The bike must support scalability.,The vehicle must be compact.,Other,"""Scalability often implies modular design and potential for expansion, contrasting with the space efficiency focus of a compact design, making simultaneous achievement challenging without compromise.""","""Prioritize core functionality within a compact footprint, allowing limited scalability through add-on accessories rather than inherent structural expansion.""",Scalability Conflict
The vehicle must have a GPS tracking system.,The bike must use a basic lock.,Security Conflict,"A GPS tracking system enhances recovery chances post-theft but is undermined by a basic lock, which offers minimal resistance to theft.",Upgrade the lock to a high-security model or integrate the GPS with an alarm system to deter theft in the first place.,Security Conflict
The bike must include an alarm system.,The vehicle must avoid electronics.,Contradiction,"An alarm system inherently relies on electronics, directly opposing the requirement to avoid them.",Re-evaluate the necessity of both requirements. Consider alternative alarm systems with minimal electronic components or compromise on the level of electronic avoidance.,Security Conflict
The vehicle must use a smart key.,The bike must have a manual ignition.,Technology Conflict,"Smart keys are electronic, while manual ignitions are mechanical, representing conflicting technologies for vehicle access and start.","Re-evaluate the requirements and choose either a smart key or manual ignition, or explore a hybrid system if feasible, clearly defining the target market and vehicle purpose.",Security Conflict
The bike must feature remote locking.,The vehicle must use a simple key.,Usability Conflict,"A simple key and remote locking offer different levels of user convenience and security, potentially leading to user frustration if both systems are poorly integrated.","Prioritize remote locking as the primary security method, with the key as a backup for emergency access or battery failure.",Security Conflict
The vehicle must have an anti-theft device.,The bike must minimize tech.,Design Conflict,"Implementing an anti-theft device inherently involves incorporating technology, directly contradicting the requirement to minimize tech.",Re-evaluate the 'minimize tech' requirement to allow for essential safety features like basic anti-theft systems or redefine 'tech' to exclude passive anti-theft mechanisms.,Security Conflict
The bike must use a fingerprint scanner.,The vehicle must be low-tech.,Technology Conflict,"Fingerprint scanners are inherently high-tech, contradicting the ""low-tech"" requirement.","Re-evaluate the necessity of both requirements, possibly replacing the fingerprint scanner with a simpler locking mechanism or relaxing the ""low-tech"" requirement to allow for specific modern features.",Security Conflict
The vehicle must include a security camera.,The bike must avoid complexity.,Cost Conflict,"Security cameras add cost, conflicting with avoiding complexity which typically implies cost reduction","Specify a low-cost, simple security camera solution or justify the added expense by improved security and reduced insurance cost.",Security Conflict
