Requirement_1,Requirement_2,Conflict_Type,Conflict_Reason,Resolution_Suggestion,Expected_Conflict
The bike must reach a top speed of 180 km/h.,The vehicle must achieve 50 km/l fuel efficiency.,Performance Conflict,"High speeds typically require more powerful engines, leading to increased fuel consumption and reduced fuel efficiency.","Explore advanced engine technologies like turbocharging, fuel injection optimization, or hybrid powertrains to balance speed and fuel efficiency.",Performance Conflict
The vehicle must accelerate to 100 km/h in 5 seconds.,The engine must prioritize low fuel consumption.,Performance Conflict,Achieving rapid acceleration typically requires higher fuel consumption due to increased engine power output.,"Optimize engine design and control systems to balance power and efficiency, exploring technologies like turbocharging or hybrid systems.",Performance Conflict
The bike must have a high-performance turbo engine.,The vehicle must maintain 40 mpg efficiency.,Performance Conflict,"A high-performance turbo engine typically prioritizes power and acceleration, leading to reduced fuel efficiency, making it difficult to achieve 40 mpg.","Explore advanced turbocharging technologies, engine management systems, and aerodynamic improvements to optimize fuel efficiency while maintaining acceptable performance levels.",Performance Conflict
The vehicle must reach 200 km/h top speed.,The bike must use a lightweight fuel-efficient motor.,Other,"Achieving 200 km/h typically requires a high-power engine, often contradicting the lightweight and fuel-efficient motor requirement.","Explore advanced lightweight materials for engine components and optimize fuel injection systems for high power at specific speeds while maintaining acceptable fuel economy.
*   **Weight Conflict:** A lightweight motor might struggle to provide the necessary power for a 200 km/h top speed.
    *   Conflict_Type: Weight Conflict",Performance Conflict
The bike must deliver 35 HP output.,The vehicle must achieve 60 km/l efficiency.,Other,"Achieving high horsepower often requires sacrificing fuel efficiency, as increased power typically demands more fuel consumption.","Explore advanced engine technologies like variable valve timing, turbocharging with optimized fuel injection, or hybrid systems to balance power and efficiency; prioritize component lightweighting.
```",Performance Conflict
The vehicle must have a sport-tuned suspension.,The bike must optimize for fuel savings.,Performance Conflict,"A sport-tuned suspension typically prioritizes handling and responsiveness over fuel efficiency, which may require a compromise in ride height and aerodynamics impacting fuel consumption.","Optimize the sport-tuned suspension for minimal impact on aerodynamics and rolling resistance, potentially incorporating adjustable suspension settings to allow for a fuel-efficient mode.",Performance Conflict
The bike must reach 150 km/h.,The vehicle must use a low-power eco engine.,Other,A low-power eco engine typically cannot deliver the necessary power to achieve a speed of 150 km/h.,"Either increase the engine power while maintaining efficiency, reduce the speed requirement, or explore advanced lightweight materials and aerodynamic designs.
```",Performance Conflict
The vehicle must include a high-RPM engine.,The bike must achieve 45 km/l efficiency.,Other,"Resolution: Explore engine technologies like variable valve timing and direct injection to optimize for both power and efficiency, or consider a smaller engine with turbocharging.
```",Requires manual review,Performance Conflict
The bike must have rapid acceleration.,The vehicle must prioritize energy efficiency.,Performance Conflict,"Rapid acceleration typically requires more power and fuel consumption, reducing energy efficiency.",Optimize the engine/motor and drivetrain for a balance between acceleration and efficiency using advanced technologies like turbocharging/supercharging with efficient engine management or hybrid/electric powertrain with regenerative braking.,Performance Conflict
The vehicle must reach 120 km/h in 6 seconds.,The bike must maintain high fuel economy.,Performance Conflict,"Achieving high acceleration (0-120 km/h in 6 seconds) typically requires a powerful engine that consumes more fuel, conflicting with the requirement for high fuel economy.","Explore hybrid powertrains, lightweight materials, or advanced engine technologies (e.g., turbocharging with optimized fuel injection) to improve the power-to-weight ratio and fuel efficiency simultaneously.",Performance Conflict
The vehicle must meet strict emission standards.,The bike must have a high-output engine.,Other,"A high-output engine typically produces more emissions, potentially making it difficult to meet strict emission standards.","Employ advanced engine technologies (e.g., catalytic converters, particulate filters, optimized combustion), explore alternative fuels, or consider hybrid/electric powertrain to mitigate emissions while maintaining performance.
*   **Technology Conflict:** {type: Technology Conflict}",Compliance Conflict
The bike must comply with urban noise limits.,The vehicle must feature a loud exhaust system.,Contradiction,A loud exhaust system inherently violates urban noise limits.,"Redesign the exhaust system to incorporate noise reduction technologies while still providing some audible feedback, balancing noise limits with desired exhaust characteristics.",Compliance Conflict
The vehicle must adhere to safety regulations.,The bike must allow manual headlight control.,Other,"Manual headlight control could override automatic headlight activation in low-light conditions, potentially compromising safety and violating safety regulations if not implemented correctly.","Implement manual control as an override only when automatic headlights are already active or design the system to ensure manual control doesn't disable automatic function below a certain light threshold, maintaining compliance.
```",Compliance Conflict
The bike must meet EU crash test standards.,The vehicle must use lightweight materials.,Weight Conflict,"Meeting stringent EU crash test standards often requires thicker, more robust structures, which may conflict with the requirement to minimize weight by using lightweight materials.","Employ advanced high-strength, lightweight materials (e.g., carbon fiber composites, high-strength steel) strategically in critical impact zones to maximize crash performance while minimizing overall weight; optimize structural design through advanced simulations to enhance energy absorption during impact without adding excessive weight.",Compliance Conflict
The vehicle must follow emissions Tier 4.,The bike must prioritize performance tuning.,Other,"Prioritizing performance tuning might lead to increased emissions, making it difficult to meet Tier 4 standards, as high-performance engines often produce more pollutants.","Implement advanced emission control technologies (e.g., improved catalytic converters, particulate filters) along with performance enhancements to balance emissions and power.",Compliance Conflict
The bike must have always-on daytime lights.,The vehicle must allow light customization.,Usability Conflict,"Always-on daytime lights may hinder the user's ability to fully customize the lighting for specific scenarios or personal preferences, reducing usability.",Implement a light customization override feature that temporarily disables the always-on daytime lights when specific custom settings are active.,Compliance Conflict
The vehicle must comply with noise restrictions.,The bike must have a sporty sound profile.,Performance Conflict,"Achieving a ""sporty sound profile"" often involves louder exhaust systems, directly conflicting with ""noise restrictions.""",Employ active sound management systems that generate desired sporty sounds internally while complying with external noise limits.,Compliance Conflict
The bike must meet regional safety codes.,The vehicle must use minimal safety features.,Safety Conflict,"Meeting safety codes inherently requires safety features, conflicting with the desire for minimal safety features.","Prioritize essential safety features that demonstrably meet regional codes while minimizing the addition of non-essential features, balancing compliance and feature minimization.",Compliance Conflict
The vehicle must follow EPA standards.,The bike must use a high-power gas engine.,Environmental Conflict,"High-power gas engines typically produce higher emissions, potentially violating EPA standards focused on environmental protection.","Explore alternative engine technologies (e.g., hybrid, electric) or implement advanced emission control systems to meet EPA standards while maintaining acceptable performance.",Compliance Conflict
The bike must adhere to lighting laws.,The vehicle must offer switchable lights.,Other,"Some lighting laws may restrict or prohibit ""switchable"" lighting features (e.g., flashing lights, excessively bright auxiliary lights) depending on the jurisdiction, leading to non-compliance if the switchable options violate those specific regulations.","Carefully define the ""switchable lights"" functionality to ensure all switchable modes remain compliant with all applicable lighting regulations, potentially by limiting switchable modes to those permitted by law or incorporating automatic shutoff features.",Compliance Conflict
The vehicle must include side-impact airbags.,The bike must weigh under 130 kg.,Other,"Integrating side-impact airbags, especially with their associated sensors and reinforcement structures, can add significant cost, potentially conflicting with a target vehicle cost","Optimize airbag design and materials to minimize cost while maintaining safety performance.
Weight Conflict: {Weight Conflict}",Safety Conflict
The bike must have ABS brakes.,The vehicle must be ultra-lightweight.,Weight Conflict,"ABS systems add weight, conflicting with the ultra-lightweight requirement.","Explore lightweight ABS materials and optimized system design, potentially compromising on the ""ultra"" aspect to achieve a reasonable weight target with ABS functionality.",Safety Conflict
The vehicle must feature a roll cage.,The bike must maintain a slim profile.,Other,"A roll cage inherently increases the vehicle's width, potentially conflicting with a slim profile.","Explore internal roll cage designs or lightweight, high-strength materials to minimize the impact on the vehicle's width.**",Safety Conflict
The bike must include a crash sensor system.,The vehicle must minimize weight.,Other,"Crash sensor systems add weight to the bike, directly conflicting with the requirement to minimize weight.",Select lightweight crash sensor components and optimize system integration to minimize added weight while maintaining functionality.,Safety Conflict
The vehicle must have reinforced bumpers.,The bike must be compact.,Other,"Reinforced bumpers increase weight, while a compact design prioritizes minimizing weight for better maneuverability and portability.","Use lightweight, high-strength materials like advanced composites or high-strength steel for the bumper to provide reinforcement without significantly increasing weight, compromising compactness.",Safety Conflict
The bike must use a sturdy steel frame.,The vehicle must weigh under 140 kg.,Weight Conflict,"A sturdy steel frame is inherently heavier than alternative materials like aluminum or carbon fiber, making it difficult to achieve a weight of under 140kg for the entire vehicle.","Explore high-strength, low-alloy steel, optimize frame geometry to minimize material usage, or consider a hybrid frame using lighter materials in non-critical areas while retaining steel for strength where needed.",Safety Conflict
The vehicle must include emergency braking.,The bike must prioritize low weight.,Weight Conflict,"Adding emergency braking systems (sensors, actuators, hydraulic lines) increases the overall weight of the bike, conflicting with the low-weight requirement.","Investigate lightweight braking components and optimize system design to minimize weight impact while maintaining braking performance, such as regenerative braking or advanced material utilization.",Safety Conflict
The bike must have a helmet lock system.,The vehicle must avoid added components.,Other,"Adding a helmet lock system necessitates an additional component, directly contradicting the requirement to avoid added components.","Re-evaluate the ""avoid added components"" requirement to allow for essential safety features, or explore minimalist helmet lock designs integrated into existing structures.",Safety Conflict
The vehicle must feature a stability control.,The bike must be lightweight.,Performance Conflict,"Stability control systems typically add weight, which can negatively impact the bike's acceleration and handling, conflicting with the ""lightweight"" requirement.","Optimize stability control system design to minimize weight impact through lightweight materials and efficient packaging, while also using advanced control algorithms to minimize intervention and maintain performance.",Safety Conflict
The bike must include a tire pressure monitor.,The vehicle must reduce mass.,Weight Conflict,"A tire pressure monitoring system (TPMS) adds mass to the bike's wheels and potentially frame due to wiring or integrated systems, counteracting the mass reduction requirement.",Select a lightweight TPMS system or integrate the TPMS sensor and electronics into existing components where possible and consider if TPMS can be made optional for certain models.,Safety Conflict
"The bike must cost under $1,200.",The vehicle must include a digital dashboard.,Other,"High-end digital dashboards with advanced features and reliable components typically exceed a budget where the total vehicle price is under $1,200.",Specify a lower-cost digital dashboard with fewer features or explore alternative display technologies to meet the budget constraint.,Cost Conflict
The vehicle must use premium alloy wheels.,"The bike must stay under $2,000.",Other,"Premium alloy wheels significantly increase the vehicle's cost, potentially exceeding the $2,000 budget.",Explore cost-effective alloy alternatives or steel wheels to meet the budget without compromising structural integrity excessively.,Cost Conflict
The bike must have a luxury paint finish.,The vehicle must be budget-friendly.,Other,"Luxury paint finishes often require premium materials and application processes, significantly increasing manufacturing costs.","Explore cost-effective paint alternatives that mimic the appearance of luxury finishes or reduce the area receiving the luxury finish.
Aesthetic Conflict: Luxury paint finishes may necessitate a design that complements the finish, potentially adding complexity and therefore higher costs that conflict with the budget requirement.",Cost Conflict
The vehicle must include adaptive headlights.,"The bike must cost below $1,500.",Cost Conflict,"Adaptive headlights can significantly increase the vehicle's production cost, making it difficult to meet the $1,500 price target.","Explore less expensive adaptive headlight technologies, negotiate component costs with suppliers, or reduce features in other areas to offset the headlight cost, if adaptive lighting performance cannot be reduced.",Cost Conflict
The bike must use high-end shock absorbers.,The vehicle must be low-cost.,Other,"Resolution: Explore mid-range shock absorbers offering acceptable performance at a lower price point or negotiate for volume discounts.
Performance Conflict: Low-cost requirements might force to use cheaper shock absorbers, thus downgrading performance.","Adjust suspension design and parameters such as spring rate and damping coefficient to achieve optimal performance within a specified cost range.
```",Cost Conflict
The vehicle must have a custom exhaust.,"The bike must stay under $1,800.",Cost Conflict,"Custom exhausts, especially high-performance ones, can significantly increase the overall cost of the vehicle, potentially exceeding the $1,800 budget.",Explore aftermarket options for a cost effective exhaust system or adjust the exhaust design for simpler manufacturability if custom is mandatory.,Cost Conflict
The bike must include a leather seat.,The vehicle must be affordable.,Other,"Leather seats are generally more expensive than synthetic alternatives, increasing the overall vehicle cost.",Explore less expensive leather alternatives or consider using a high-quality synthetic material that mimics the look and feel of leather while remaining affordable.,Cost Conflict
The vehicle must feature a premium sound system.,"The bike must cost under $2,500.",Cost Conflict,"A premium sound system often adds significant material and labor costs, making it difficult to meet the $2,500 target price for a bike.","Compromise on the sound system quality or features, or explore alternative materials and manufacturing processes to reduce overall costs without sacrificing sound quality too much, or remove the premium sound system altogether.",Cost Conflict
The bike must have a titanium frame.,The vehicle must minimize production costs.,Cost Conflict,Titanium frames are significantly more expensive than alternatives like steel or aluminum.,"Explore alternative frame materials that offer a balance of strength, weight, and cost, such as high-strength steel or aluminum alloys.",Cost Conflict
The vehicle must include a navigation system.,"The bike must be priced under $1,000.",Cost Conflict,"Integrating a fully functional navigation system might significantly increase the bike's production cost, exceeding the $1,000 price limit.","Use a basic, low-cost navigation system, integrate smartphone mirroring functionality, or offer navigation as an optional add-on to stay within budget.",Cost Conflict
The vehicle must have a 350 km electric range.,The bike must use a small battery pack.,Performance Conflict,A small battery pack may not provide sufficient energy to achieve a 350 km electric range.,Increase the battery energy density or reduce vehicle weight to improve range with a smaller battery.,Battery Conflict
The bike must charge to 80% in 20 minutes.,The vehicle must use a lightweight battery.,Resource Conflict,"Fast charging often requires larger battery capacity or sophisticated cooling systems, conflicting with the lightweight battery requirement due to increased material use for cooling/larger pack.","Invest in advanced battery technologies (e.g., solid-state) that offer both high energy density and fast charge capabilities, or consider pre-heating the battery during charging within safe operating limits.",Battery Conflict
The vehicle must include a high-capacity battery.,The bike must fit a compact design.,Other,"The high-capacity battery adds significant weight, potentially conflicting with the compact design which typically aims for minimal weight.","Explore advanced battery technologies (e.g., solid-state) offering higher energy density for reduced weight or compromise battery capacity.**
*   **Cost Conflict: {type}",Battery Conflict
The bike must offer 400 km range.,The vehicle must minimize battery size.,Performance Conflict,"Achieving a 400 km range typically necessitates a larger battery, directly conflicting with the requirement to minimize battery size, impacting the vehicle's overall performance capabilities such as weight and acceleration.","Optimize battery energy density, improve vehicle aerodynamics, and incorporate regenerative braking to maximize range with a smaller battery.",Battery Conflict
The vehicle must support fast charging.,The bike must use a slim battery.,Other,"A slim battery typically has lower capacity and/or discharge rates, potentially hindering the ability to support fast charging (which demands high current draw).","Investigate high-density battery chemistries and advanced thermal management to balance slim form factor with fast charging capabilities.

Conflict_Type: Weight Conflict",Battery Conflict
The bike must have a 300 km range.,The vehicle must reduce battery weight.,Performance Conflict,"Reducing battery weight directly reduces energy storage capacity, compromising the achievable 300 km range.",Employ advanced battery chemistries with higher energy density or optimize vehicle aerodynamics and rolling resistance.,Battery Conflict
The vehicle must use a long-life battery.,The bike must have a small footprint.,Weight Conflict,"Long-life batteries often have higher energy density materials, resulting in increased weight which negatively impacts vehicle footprint constraints.","Optimize battery chemistry and vehicle design to minimize weight while maintaining desired battery life and footprint, potentially exploring solid-state batteries.",Battery Conflict
The bike must include a swappable battery.,The vehicle must limit battery space.,Other,"A swappable battery inherently requires a certain amount of space for access and removal, directly contradicting the requirement to limit battery space.",Re-evaluate and quantify the acceptable minimum battery space needed for a swappable design or explore alternative compact swappable battery technologies.,Battery Conflict
The vehicle must offer 250 km range.,The bike must use a minimal battery.,Performance Conflict,"Achieving a 250 km range typically requires a larger battery capacity, directly conflicting with the minimal battery requirement.","Re-evaluate and negotiate either the range requirement downwards or the battery size constraint upwards, or explore advanced battery technologies with higher energy density.",Battery Conflict
The bike must charge in 15 minutes.,The vehicle must have a compact battery.,Performance Conflict,"Charging a battery quickly typically requires a larger battery pack with enhanced thermal management to handle the higher charge rates without damaging the cells or significantly reducing their lifespan, contradicting the desire for a compact battery.","Negotiate a balance between charging time and battery size, possibly exploring advanced battery chemistries and thermal management solutions to achieve fast charging in a smaller battery form factor, or consider a modular battery approach.",Battery Conflict
The vehicle must use eco-friendly materials.,The bike must have a 40 HP engine.,Other,"A 40 HP engine typically necessitates combustion, conflicting with the use of eco-friendly materials for overall vehicle construction which requires electric or hybrid power source.","Explore hybrid powertrain options, smaller eco-friendly engine or lightweight eco-friendly materials that can improve vehicle performance and meet HP requirements without requiring such a powerful engine.",Environmental Conflict
The bike must minimize carbon emissions.,The vehicle must use a high-performance motor.,Other,"High-performance motors often prioritize power and acceleration over fuel efficiency, potentially increasing carbon emissions if not carefully designed.","Explore high-efficiency motor designs (e.g., electric, optimized combustion) or advanced control strategies to balance performance with reduced emissions.",Environmental Conflict
The vehicle must be fully recyclable.,The bike must include a powerful gas engine.,Sustainability Conflict,"A powerful gas engine inherently contradicts full recyclability due to complex component separation, material contamination from fluids and emissions control devices, and the inherent environmental impact of combustion engines.","Explore alternative powertrains like electric, hybrid, or hydrogen fuel cells that offer better recyclability prospects.",Environmental Conflict
The bike must meet green certification.,The vehicle must prioritize speed.,Performance Conflict,"Achieving high speed often necessitates a more powerful engine or motor, aerodynamic designs, and lighter materials, potentially conflicting with the sustainable materials, reduced emissions, and energy efficiency goals implied by green certification.","Explore hybrid or electric powertrains optimized for both performance and efficiency, utilize lightweight and sustainable materials, and optimize aerodynamics to reduce drag, balancing speed and environmental impact.",Environmental Conflict
The vehicle must reduce emissions.,The bike must have a turbocharged engine.,Performance Conflict,"Turbocharged engines, while enhancing power, often lead to increased fuel consumption and emissions, potentially conflicting with the emissions reduction goal.","Implement advanced engine management systems, catalytic converters, and potentially hybrid technology to mitigate emissions from the turbocharged engine, balancing performance and environmental targets.",Environmental Conflict
The bike must use biodegradable plastics.,The vehicle must deliver 35 HP.,Other,"Biodegradable plastics may not possess the required strength and durability for certain engine components necessary to reliably deliver 35 HP, potentially leading to premature failure or reduced performance.",Explore high-performance biodegradable plastics or alternative materials that balance environmental impact with the necessary mechanical properties to support 35 HP engine operation.,Environmental Conflict
The vehicle must follow eco standards.,The bike must use a loud exhaust.,Environmental Conflict,"Loud exhausts contribute to noise pollution and air pollution (due to incomplete combustion and particulate matter), directly contradicting eco standards focused on minimizing environmental impact.","Explore alternative sound-enhancing technologies that meet noise regulations and minimize emissions, such as electronic sound augmentation or exhaust systems with integrated catalytic converters and particulate filters.
Conflict_Type: Noise Conflict",Environmental Conflict
