Requirement_1,Requirement_2,Conflict_Type,Conflict_Reason,Resolution_Suggestion,Expected_Conflict
The vehicle must use a matte finish.,The bike must have glossy paint.,Aesthetic Conflict,"Matte and glossy finishes have different visual appeals and light reflection properties, leading to a disjointed and unappealing aesthetic if applied to the same vehicle.","Choose either a matte or glossy finish for the entire vehicle, or use them strategically in different areas to achieve a complementary design.",Aesthetic Conflict
The bike must have a rugged aesthetic.,The vehicle must be sleek.,Aesthetic Conflict,"""Rugged"" and ""sleek"" are opposing aesthetic design principles, making it difficult to satisfy both simultaneously.","Define a specific aesthetic that blends elements of ruggedness (e.g., exposed frame, robust materials) with sleekness (e.g., streamlined silhouette, integrated components) in a balanced manner, possibly through carefully chosen textures and surface treatments.",Aesthetic Conflict
The vehicle must have a quiet electric motor.,The bike must produce a loud roar.,Contradiction,A quiet electric motor directly opposes producing a loud roar; electric motors are inherently quiet compared to internal combustion engines.,"Clarify the intended vehicle; these requirements cannot coexist in a single conventional vehicle. A hybrid system *might* satisfy both, using the electric motor for quiet operation and a separate sound system for a simulated roar, but that adds complexity.",Noise Conflict
The bike must meet silent operation standards.,The vehicle must have a sport exhaust.,Performance Conflict,"A sport exhaust inherently increases noise levels, conflicting with the requirement for silent operation, and silent operation might affect the combustion process and therefore vehicle performance.","Investigate advanced exhaust baffling and active noise cancellation technologies to reduce exhaust noise while maintaining some performance gains, or redefine ""silent operation"" with specific decibel limits that allow for a sport exhaust with noise reduction features.",Noise Conflict
The vehicle must reduce noise to 50 dB.,The bike must sound aggressive.,Aesthetic Conflict,"""Reducing noise to 50dB directly contradicts the requirement for an aggressive sound profile.""","""Modulate aggressive engine sounds through targeted speaker systems (active sound design) within the 50dB limit.""",Noise Conflict
The bike must operate silently.,The vehicle must use a noisy engine.,Contradiction,"Requirement 1 explicitly states silence, while Requirement 2 mandates a noisy engine, directly opposing each other.","The requirements are mutually exclusive; one must be revised or removed. A compromise might involve a ""quiet"" engine design with noise reduction features, or specifying operating conditions where either silence or noise is acceptable.",Noise Conflict
The vehicle must comply with 60 dB limits.,The bike must have a bold sound.,Noise Conflict,"A ""bold sound"" implies exceeding the 60 dB noise limit.","Redesign the exhaust or sound system to achieve a distinctive, yet compliant, sound signature.",Noise Conflict
The bike must be noise-free.,The vehicle must feature a loud muffler.,Contradiction,"The requirements for a noise-free bike and a loud muffler are mutually exclusive, as a loud muffler inherently generates noise.","Re-evaluate and clarify the intended use case; perhaps a ""quiet mode"" exists or ""loud muffler"" is metaphorical for powerful acceleration.",Noise Conflict
The vehicle must minimize sound output.,The bike must enhance exhaust noise.,Contradiction,"Minimizing sound output is directly opposite to enhancing exhaust noise, creating a fundamental contradiction.","The requirements must be re-evaluated and prioritized; one should be revised or removed, or potentially limited by setting specific acceptable ranges for both.",Noise Conflict
The bike must stay under 55 dB.,The vehicle must sound powerful.,Noise Conflict,"A powerful sound often implies a higher decibel level, conflicting with the quiet operation requirement.","Design the bike to produce a 'powerful' sounding frequency range (e.g., low-frequency rumble) while staying within the 55 dB limit through acoustic dampening and careful sound shaping.",Noise Conflict
The vehicle must use a silent system.,The bike must have a deep tone.,Contradiction,"A ""silent system"" inherently opposes the presence of a ""deep tone,"" which implies audible sound emission.","Clarify the intended use cases and specify acceptable noise levels or operating conditions for each requirement; for example, ""Silent system during low-speed operation, deep tone for safety alerts.""",Noise Conflict
The bike must meet quiet zone rules.,The vehicle must amplify sound.,Contradiction,"Meeting quiet zone rules inherently conflicts with amplifying sound, as one requires minimal noise and the other requires increased noise output.","Design a system that intelligently manages sound amplification, disabling it in quiet zones and enabling it elsewhere, possibly with geofencing.",Noise Conflict
The vehicle must include a unique logo.,The bike must reduce branding costs.,Other,"Resolution: Explore cost-effective logo designs or consider a simplified, less expensive branding approach.",Requires manual review,Other Conflict
The bike must offer custom decals.,The vehicle must keep production simple.,Other,Custom decals increase production complexity and material costs.,"Offer a limited selection of pre-designed decals or outsource the custom decal application to a third-party service.
Conflict_Type: Time-to-Market Conflict",Other Conflict
The vehicle must have a special edition trim.,The bike must stay low-cost.,Other,Resolution: Carefully select special edition trim elements that add perceived value without substantially increasing manufacturing expenses.,Requires manual review,Other Conflict
The bike must include a rare feature.,The vehicle must avoid extras.,Other,"A rare feature might necessitate a design that clashes with the minimalist ""avoid extras"" philosophy.","Define ""rare feature"" and ""extras"" precisely, prioritizing essential functionality with minimal design impact.
*   **Structural Conflict:** Conflict_Type: Structural Conflict",Other Conflict
The vehicle must use a distinct color.,The bike must use standard paint.,Cost Conflict,"Distinct colors often require custom mixing or special pigments, increasing paint cost compared to standard paints.","Define ""distinct"" within a cost constraint, allowing for a limited range of non-standard colors that are still cost-effective.",Other Conflict
The bike must have a limited-run design.,The vehicle must be mass-produced.,Scalability Conflict,Limited-run designs inherently conflict with the economies of scale required for mass production.,"Re-evaluate the 'limited-run' aspect to allow for modularity or limited customization within a larger production framework, balancing exclusivity with mass production efficiency.",Other Conflict
The vehicle must offer a niche accessory.,The bike must cut costs.,Cost Conflict,"Offering a niche accessory likely increases production costs, directly conflicting with the requirement to cut costs.",Conduct a thorough cost-benefit analysis of the niche accessory; explore cheaper alternative accessories or optional features; or re-evaluate market demand for the accessory against potential cost savings.,Other Conflict
The bike must include a bespoke part.,The vehicle must simplify assembly.,Cost Conflict,"Bespoke parts typically increase material and manufacturing costs, directly contradicting the need for simplified assembly aimed at reducing labor costs.","Evaluate the necessity of the bespoke part, explore alternative standardized components, or redesign the bespoke part for easier assembly.",Other Conflict
The vehicle must have a custom interior.,The bike must reduce expenses.,Cost Conflict,"Custom interiors often increase expenses, directly contradicting the requirement to reduce expenses.","Explore cost-effective customization options or prioritize expense reduction, potentially limiting the scope of the custom interior.",Other Conflict
The bike must feature a signature look.,The vehicle must be generic.,Aesthetic Conflict,"A ""signature look"" implies a unique and recognizable design, directly contradicting the requirement for a ""generic"" appearance, which suggests a lack of distinguishing features.","Redefine ""signature look"" to be a subtle, recurring design element that doesn't compromise the overall generic aesthetic, or prioritize one requirement over the other based on marketing and target audience analysis.",Other Conflict
